<?xml version="1.0" encoding="UTF-8"?>
<xs:schema xmlns:xs="http://www.w3.org/2001/XMLSchema" elementFormDefault="qualified">
	<xs:element name="table">
		<xs:complexType>
			<xs:sequence>
				<xs:element name="record" type="recordType" maxOccurs="unbounded"/>
			</xs:sequence>
		</xs:complexType>
	</xs:element>
	<xs:complexType name="recordType">
		<xs:sequence>
			   <xs:element name="column" type="columnType" minOccurs="0" maxOccurs="unbounded"/>		
		</xs:sequence>
	</xs:complexType>
	<xs:complexType name="columnType">
		<xs:simpleContent>
			<xs:extension base="xs:string">
				<xs:attribute name="name" type="xs:string"/>
			</xs:extension>
		</xs:simpleContent>
	</xs:complexType>
</xs:schema>
